,Unnamed: 0,Datetime,Tweet Id,Text,Username,Clean,Clean_Text_Length,Language
1918,1918,2022-10-12 04:25:53+00:00,1580052110015463424,@niktophobic not completely wrong naman. pero other sea countries are not as badly affected compared to the ph. more moderate yung currency depreciation and inflation sa kanila. unlike ours.,dvnnmrr,completely wrong naman country badly affected compared moderate currency depreciation inflation unlike,177,en
1919,1919,2022-10-11 16:35:24+00:00,1579873312359841795,reminding us how inflation works,aldrinosandres,reminding inflation,32,en
1921,1921,2022-10-11 16:26:41+00:00,1579871117107265538,"@keel0986 @akofeelinggwapo to add, his concept of how the dollar rate strengthened is incorrect. he said, he wanted to clear things out which he failed to even do. 
ang federal reserve nag trigger to aggressively hike interest rates to tame inflation, maong ni taas ang demand sa dollar.",just_Christon,concept dollar strengthened incorrect wanted clear thing failed federal reserve trigger toaggressively interest ratesto inflation maong demand dollar,256,en
1922,1922,2022-10-11 16:19:48+00:00,1579869386541629441,"@keel0986 @akofeelinggwapo i was criticizing how he said it. 

not the reason sa inflation and weakening sa exchange rate. 🤭
and to go back to my tweet, i said i understood what he meant even if he was grasping for the right words to say.",just_Christon,criticizing reason inflation weakening exchange tweet understood meant grasping right,207,en
1923,1923,2022-10-11 12:39:21+00:00,1579813907031789569,why we're losing the inflation game. and why the worst hasn't happened yet.,mbsperez,losing inflation worst happened,75,en
1925,1925,2022-10-11 08:54:29+00:00,1579757316819537922,welkin inflation is real for ios users. 🥲🥲🥲,marseupial,welkin inflation,39,en
1927,1927,2022-10-10 07:42:10+00:00,1579376729344593920,"dr. batu explains the current inflation rate 
https://t.co/hz3iv9n91o",BisayangIlokano,explains current inflation,44,en
1929,1929,2022-10-06 11:33:44+00:00,1577985456335073280,"sabi ng 31m sd card, world wide ang inflation po opo 💩🤡",dailyjayvz,world inflation,50,en
1930,1930,2022-10-06 10:42:54+00:00,1577972661053198336,the inflation is too high that people's salary is no longer enough. they opt to risk their life to earn extra money. some people are chosing to work abroad. our country is in crisis while our leader is enjoying a lavish life. make it make sense.,jjwanjwehop,inflation people's salary longer extra money people chosing abroad country crisis leader enjoying lavish sense,245,en
1933,1933,2022-10-06 09:57:01+00:00,1577961114557902848,thinking about getting a side hustle cause of inflation 🙃🙃🙃,bonchykels,thinking getting hustle inflation,55,en
1941,1941,2022-10-05 13:54:15+00:00,1577658427265859584,"i know this will create a lot of tension especially kung narrow-minded ka *ehem* but the point here is the inflation, my dear. ano to, inflation versus increase?

sumasabay din sa pagtaas ng pride ng iba eh, owshiiiiii",superreldee07,create tension especially narrow minded point inflation inflation versus increase sumasabay pagtaas pride owshiiiiii,216,en
1945,1945,2022-10-05 11:17:18+00:00,1577618931782938624,"sky-high inflation rates 
plunging php 
less-than-average macro-economic conditions 

tapos unity eme eme pa rin? wow. just wow.",arjei26,inflation plunging average macro economic condition unity,124,en
1950,1950,2022-10-05 08:49:57+00:00,1577581847415881728,where to put our hard-earned money to beat inflation?!? 💸😫😩,jjvbesa,earned money inflation,55,en
1958,1958,2022-10-05 04:21:33+00:00,1577514305003872256,"everything is being inflated, even institutions to accommodate more trapos and dynasties. uso daw kasi inflation so why not inflate power? 😤",ariesarugay,inflated institution accommodate trapos dynasty inflation inflate power,138,en
1959,1959,2022-10-05 03:42:15+00:00,1577504411919986690,"justice bersamin: “it’s immaterial whether the singapore trip was paid using public funds or not.”

with all due respect, it is—the peso at its lowest, inflation at its highest, the country still reeling from #kardingph, etc.

kabastusan ang pagpapakasasa sa gitna ng kahirapan.",claudiopoy,justice bersamin immaterial singapore public respect isthe lowest inflation highest country reeling kabastusan pagpapakasasa gitna kahirapan,260,en
1962,1962,2022-10-05 01:53:04+00:00,1577476936045297669,"circa 2013, a ride home is just 6 php and a 10 php train ride. now fast forward to 2022, the minimum fare for both is more or less double the amount but the minimum wage barely increase since 2013 from 466 php to 570 php. inflation is felt in every ride. what's left to take home? https://t.co/tgf9zj6iwi",jilsonstiu,circa train forward minimum double minimum barely increase inflation,254,en
1963,1963,2022-10-05 01:37:59+00:00,1577473140447653888,@abscbnnews para din palang f1 race yung inflation rate no,awesome_drew,palang inflation,46,en
1964,1964,2022-10-05 01:17:37+00:00,1577468014991007744,inflation at 6.9% as of september 😦,jecmara25,inflation september,30,en
1966,1966,2022-10-04 16:52:50+00:00,1577340981342777344,inflation is super fucking real. road to golden era talaga malala.,EzCrizzy,inflation super fucking golden talaga malala,66,en
1967,1967,2022-10-04 14:45:31+00:00,1577308943084572672,"formula 1 ang sagot sa inflation, slow economic growth and typhoon casualties and effects 🥳",nobamay,formula sagot inflation economic growth typhoon casualty effect,87,en
1969,1969,2022-10-04 12:09:24+00:00,1577269653029924865,halloween party and christmas party next.  so forda malacanang catering project 🤣 while inflation and high dollar!!!!,jhescorial,halloween party christmas party forda malacanang catering project inflation dollar,114,en
1971,1971,2022-10-04 08:04:31+00:00,1577208026305794048,i witnessed how inflation kicked our asses when fortune cluster roll (yung malaking ensaymada sa mercury drug) was only p62 last july and now it’s at p79 🥲,marielsevilla_,witnessed inflation kicked fortune cluster malaking ensaymada mercury,152,en
1973,1973,2022-10-04 03:13:46+00:00,1577134856475009024,"this has been the top-tier and will be the top-tier again but will not the same price as before. 

look what inflation could do...
masarap pero pahirap, wews.",grmfgrsn_,price inflation masarap pahirap,155,en
1974,1974,2022-10-04 02:49:51+00:00,1577128839163301888,@thekidwithhalo emeeee inflation is real charot,gooddb0y,emeeee inflation charot,31,en
1975,1975,2022-10-04 02:47:41+00:00,1577128292900929536,"@societyofhonor @fdpascual @maamsyj a competent president of the country will address national debt, inflation and peace &amp; order in the 1st 100 days in office to live up to the expectations of the “usual” honeymoon period. dayunyor did nothing! instead he partied &amp; traveled",mgb819,competent president country address national inflation peace order office expectation usual honeymoon period dayunyor instead partied traveled,233,en
1976,1976,2022-10-04 01:52:45+00:00,1577114469401886721,"@not_alfonso yes, global inflation is real.",NewPH2022,global inflation,30,en
1977,1977,2022-10-04 01:45:23+00:00,1577112617201520640,inflation este come back to the young and beautiful you.,_rojyu,inflation young beautiful,56,en
1978,1978,2022-10-04 00:05:51+00:00,1577087565110575104,"if only inflation is like airline lifevest, blow tube to inflate, push pin inward to deflate..
#inflation",littl3john,inflation airline lifevest inflate inward deflate,94,en
1981,1981,2022-10-03 12:47:21+00:00,1576916815820648454,nigga be questioning why there's inflation when they voted for a fucking dictator,Nniikkaayyy,nigga questioning inflation voted fucking dictator,81,en
1984,1984,2022-10-03 09:31:14+00:00,1576867464410910720,@jumbotrashcan whew. inflation. i remember this used to be just 49 pesos.,gooddb0y,inflation remember,55,en
1985,1985,2022-10-03 08:59:28+00:00,1576859468150714368,inflation is the journey not the destination,yomturista,inflation journey destination,44,en
1987,1987,2022-10-03 06:21:53+00:00,1576819812734406656,yeah yeah i know inflation is high here but have you tried just disagreeing with inflation? #marcosinutil https://t.co/gkbje7w0ta,itsjomcorpuz,inflation tried disagreeing inflation,91,en
1988,1988,2022-10-03 05:05:10+00:00,1576800503937536001,inflation but i crave. 😭,PAULiiingdown,inflation crave,22,en
1989,1989,2022-10-03 01:19:47+00:00,1576743785639182336,"i feel my friend din naman. imagine ang mahal na ng groceries now tapos ang mga bumoto kay bbm, who doesnt care about inflation, eh freeloader sa kanya?",GentriSenyo,friend naman imagine grocery bumoto inflation freeloader,152,en
1991,1991,2022-10-02 14:46:14+00:00,1576584346705666048,"with the inflation and impact of typhoon, the apologist will say?? 🤡🤡",onyt07leo,inflation impact typhoon apologist,66,en
1992,1992,2022-10-02 09:23:49+00:00,1576503207500476417,"@bbmholic_1972 party here and there while the country is faced with inflation, weakening peso, storm devastation, shortage of basic commodities, covid 19 pandemic, corruptions, crimes and injustices, gov’t loans in trillions! kawawang pilipinas!",kxops101,party country faced inflation weakening storm devastation shortage basic commodity covid pandemic corruption crime injustice trillion kawawang pilipinas,226,en
1995,1995,2022-10-02 02:36:30+00:00,1576400705182928896,"grabe 11php n to
inflation is real https://t.co/iwbc5ua9pb",Kage062684,toinflation,31,en
1997,1997,2022-10-01 12:40:37+00:00,1576190348438577157,"@greencross123 @binimarcia major cause why phl has 13t debt, 7% inflation, 62.1% debt to gdp ratio, reduced $84b reserve &amp; run away forex",mgb819,major inflation ratio reduced reserve forex,104,en
2008,2008,2022-09-29 10:46:06+00:00,1575436753372336129,willis towers watson (wtw) report states ph companies are budgeting an average median salary increase of 5.7% next year to combat inflation and address potential attrition. is your company compensation &amp; annual merit increase plans (or perhaps vs 2021) aligned with this forecast?,kingdelrosario,willis tower watson report state company budgeting average median salary increase combat inflation address potential attrition company compensation annual merit increase aligned forecast,274,en
2009,2009,2022-09-28 07:33:52+00:00,1575025986621829122,@rda47338427 monitoring? and then what? what is he doing and what is he going to do to ease the effect of inflation and prevent  the continued increase of basic commodities’ prices. and then help our farmers since he assumed the responsibility of doa head. what now?,kxops101,monitoring going effect inflation prevent continued increase basic commodity price farmer assumed responsibility,251,en
2010,2010,2022-09-28 05:47:20+00:00,1574999175678242816,"@rolem03_chick @pagezh @pads_nosi @jaysalas101 @bongya98 @tishacm @pinoyanghang almighty dollar giving uk's pound sterling a whoop-ass beating? even us rapper 50 cent (curtis jackson) wish to be known as 85 cent, to adjust for inflation? https://t.co/rjjuzs6lqt",molavefinds,almighty dollar giving pound sterling whoop beating rapper curtis jackson known adjust inflation,151,en
2013,2013,2022-09-27 14:25:31+00:00,1574767196013993984,will “dollarozation” going to happen in the philippines? with the current rate of inflation…. are we going to follow el salvador???? argentina???? 😩,WigglyyBuff,dollarozation going happen philippine current inflation going follow salvador argentina,143,en
2017,2017,2022-09-27 09:01:03+00:00,1574685538564513793,"kung hindi lang talaga sa inflation rate, papatusin ko na kayo dyan sa bgc eh.

though thanks for calling me twice to two diff. tech pos. appreciate it, still not the right time.",huhppy,talaga inflation papatusin thanks calling twice different appreciate right,176,en
2019,2019,2022-09-26 14:20:30+00:00,1574403544441970688,"paid my clothes today with @cryptocom and found that the total value was around 80 usd.

in 2015, 80 usd was just 3,520 php. today, 80 usd is around 4,732 php. you could buy atleast 10 clothes in uniqlo already. that’s how fast php has devalued… sux to live with this inflation https://t.co/kpkvb9bhan",TristanBal,clothes found total value atleast clothes uniqlo devalued inflation,234,en
2020,2020,2022-09-26 13:29:16+00:00,1574390650413322241,im thinking of dressing up as jeff dahmer for halloween but that's definitely going to be offensive for his victims and their families so im just gonna be dressing up as the inflation rate instead,bohosiseol,thinking dressing dahmer halloween definitely going offensive victim family going dressing inflation instead,196,en
2022,2022,2022-09-26 07:10:12+00:00,1574295256891523072,"not to mention how typhoons and other related disasters would affect supply chains, especially rice and other crops, and make inflation worse than what it is right now. in short, we're all fucked.

anihan pa man din niyan. sayang.",nicxthegeek,mention typhoon related disaster affect supply chain especially inflation worse right short fucked anihan niyan sayang,228,en
2023,2023,2022-09-26 03:36:01+00:00,1574241353495904262,"good luck na lang sa mga nasalanta: high inflation would mean harder short-term recovery (materiel for reconstruction), high interest rates would mean harder long-term recovery (loans for farmers, businesses).",nicxthegeek,nasalanta inflation harder short recovery materiel reconstruction interest harder recovery farmer business,209,en
2026,2026,2022-09-24 15:37:43+00:00,1573698198828634114,"gpu pricing down 📉
inflation 📈
weakening peso 💸

brb numbing the pain with kpop merch",joersays,pricing inflation weakening numbing merch,78,en
2031,2031,2022-09-23 11:13:03+00:00,1573269207739170816,sea level is catching up with inflation 🫠🫠,xtian_daveRND,level catching inflation,39,en
2032,2032,2022-09-23 05:13:38+00:00,1573178756432539649,"1. no doh secretary
2. weak peso = inflation
3. high prices of tradable commodity like electricity
4. silence about west phil sea dispute
5. pangit na ate suggests that we “move on” 

a day of reckoning will come.",jmdanganemd,secretary2 inflation3 price tradable commodity electricity4 silence dispute5 pangit suggests reckoning,204,en
2033,2033,2022-09-23 04:27:04+00:00,1573167038776119298,bangko sentral ng pilipinas hikes interest rates by 50 basis points (0.50%) to curb inflation.,alexis_banga,bangko sentral pilipinas interest basis point inflation,91,en
2036,2036,2022-09-22 09:24:54+00:00,1572879602758066178,"we should be very concerned at weakening peso. one thing is for sure we now have to pay more for what we import such as oil, rice, pork and other food products that are short in supply. ofws, freelancers and dollar earners also face uncertainties bec of inflation. fyi💯",James01semaj,concerned weakening thing import product short supply freelancer dollar earner uncertainty inflation,268,en
2039,2039,2022-09-20 21:49:16+00:00,1572342154248462337,"@loos3seal @abscbnnews @dontagala they will be forever haunted with the crime against humanity during his father and even him not paying taxes. party everywhere where filipinos don't have food to eat, high inflation, high fare and prices of commodities.",fearlessman76,forever haunted crime humanity father paying party filipino inflation price commodity,219,en
2042,2042,2022-09-20 03:57:56+00:00,1572072543099719680,"the ph #inflation may be high &amp; unpleasant, but #stockmarket investors are advised not to be disheartened by this scenario. more about inflation rate and some tips on how to beat it.  #seatsfortwo
https://t.co/lqoifbcfbl

#financialwellness #bdoph  #bdounibank #saveandinvest",livingMarjorney,unpleasant investor advised disheartened scenario inflation,163,en
2044,2044,2022-09-20 01:23:35+00:00,1572033698035564547,moody’s analytics: u.s. consumer demand fairly healthy despite elevated inflation; europe is in the brink of recession.,alexis_banga,moody analytics consumer demand fairly healthy despite elevated inflation europe brink recession,118,en
2046,2046,2022-09-17 12:45:06+00:00,1571118046210854915,dear 31m wag kayo magreklamo sa transpo and bilihin due to inflation. aba eh wala plano o contingency plan pinuno niyo eh. live with it idiots. well deserved!,kntmrco,magreklamo transpo bilihin inflation plano contingency pinuno idiot deserved,156,en
2050,2050,2022-09-16 17:13:14+00:00,1570823134378598401,"fare hikes, php at it's weakest performance, uncontrolled inflation, what's next?!!!",iAm_RedSurio,weakest performance uncontrolled inflation,84,en
2051,2051,2022-09-16 07:37:40+00:00,1570678287369904135,"as an investor of dollar currency,nakak kilig tingnan. pero on the contrary pinaka apektado dito mga mahihirap, plus inflation sa basic needs. nakakatakot ang coming years under this administration https://t.co/cg2nbn19xq",kane4_kane,investor dollar currency nakak kilig tingnan contrary pinaka apektado mahihirap inflation basic nakakatakot coming administration,197,en
2053,2053,2022-09-14 17:18:33+00:00,1570099696366125056,"working in a customer service for a food delivery and take away services, all of their items had increased. it is an australian account and madami sa mga customers namin na-aray din sa pricing, but inflation is damn real all over the world. hindi lang dito.",16lunaestrella,working customer service delivery service increased australian account madami customer pricing inflation world,257,en
2054,2054,2022-09-14 04:50:48+00:00,1569911517822488578,@ljawesomepotato inflation hits different 🙂,DaenAlan,inflation different,24,en
2055,2055,2022-09-13 23:57:45+00:00,1569837771476594690,"@vp because there is consensus among economists that the ""inflation reduction act"" is actually not going to reduce inflation rather, it is inflationary. such a 🤡 show.",cdoRobT,consensus economist inflation reduction actually going reduce inflation inflationary,161,en
2056,2056,2022-09-13 23:50:22+00:00,1569835914402353153,"@rusexercises attn duty officer: kindly relay my message to col. gen. yuriy e. sadovenko. spaciba!
dear col. gen. yuriy e. sadovenko,
there is a program i believe that is causing world inflation. kindly see through it. it must be stopped. thank you!🤍",IAmSerenity37,officer kindly relay message yuriy sadovenko spaciba yuriy sadovenko program believe causing world inflation kindly stopped thank,233,en
2059,2059,2022-09-12 12:53:37+00:00,1569308250750996480,"back to work today!

less filipinos experienced hunger in the second quarter of 2022, according to a study of sws.

ease of doing business and return to work contributed to it, but inflation might reverse the trend.

my report for @tvpatrol tonight!",JervisManahan,filipino experienced hunger second quarter according study business return contributed inflation reverse trend report tonight,229,en
2060,2060,2022-09-11 18:26:28+00:00,1569029626865000448,"pinaguusapan na pala sa un yung inflation reduction act, meaning didiscuss na din sa office and adjustments🥲🥲🥲",joshhorrific,pinaguusapan inflation reduction meaning didiscuss office adjustment,107,en
2062,2062,2022-09-11 12:06:49+00:00,1568934082607984640,@celestine_dkila bata ka pa wala kang alam research muna before you judge our president hé onle have 100 days da discover corruption and inflation here happen whole world not only here also war uktaine vs russia please pakilawakan nm yung brain wala pa ng 6years anu to demolotion job,jonathan_omaga,research judge president discover corruption inflation happen world uktaine russia pakilawakan brain demolotion,261,en
2064,2064,2022-09-11 11:45:56+00:00,1568928828092981249,@datumx11 common hindi lang sa pinas ang may inflation whole world may pagtaas ng bilihin open your mind pakilawakan ang brain please research before you judge our president hé is only 100days,jonathan_omaga,common pinas inflation world pagtaas bilihin pakilawakan brain research judge president,178,en
2066,2066,2022-09-11 06:18:49+00:00,1568846507893493760,".@tambisan_1979 put together this collection of #marcositakwil prints for #ggssg2022 #jointambe 

it's the senior dictator's birth anniv today, and junior is looking to coast on nostalgia + leftover goodwill amid painful inflation + fracturing apolo10 political base #rejectmarcos https://t.co/etdyj9e5fk",paolojcruz,collection print senior dictator's birth anniv junior looking coast nostalgia leftover goodwill painful inflation fracturing apolo10 political,213,en
2069,2069,2022-09-10 10:44:19+00:00,1568550931809337350,note to self: iwasan ang lifestyle inflation.,xirkul,iwasan lifestyle inflation,45,en
2070,2070,2022-09-10 04:48:15+00:00,1568461325420101632,@lesleyellyse @legkram_yabyab @cruzkaren53 yes. this is global inflation not just the philippine peso. ☹️,kinismoko,global inflation philippine,59,en
2073,2073,2022-09-08 21:25:01+00:00,1567987397287354368,camiguin inflation rate slows to 7.4% https://t.co/belgoumrnc,CliffordBrazier,camiguin inflation slows,34,en
2074,2074,2022-09-08 14:35:29+00:00,1567884333419216897,@attyharryroque @bongbongmarcos what his plan about the inflation? does he have any concrete plans about the marginalize sector specially the persons with disability and senior citizens?,JOHNnatics,inflation concrete marginalize sector specially person disability senior citizen,154,en
2079,2079,2022-09-07 05:23:07+00:00,1567382937464881152,inflation is for the rich makes more money,YNGPARDS,inflation money,42,en
2083,2083,2022-09-06 14:48:21+00:00,1567162794327547908,inflation slows to 6.3 percent in august: psa:https://t.co/lc7jqo6zwm via @abscbnnews,chris21405,inflation slows august,46,en
2084,2084,2022-09-06 14:01:00+00:00,1567150880193146881,need another income source as inflation is catching up so quickly. 😿,uelbaldevia,income source inflation catching quickly,66,en
2085,2085,2022-09-06 02:33:53+00:00,1566977961412415489,starting september 1 nagtaas ng price point lahat ng jollibee products. ang galing galing noh? all because our inflation is not that high. kakatuwa. woooohooo!!!,jezonne,starting september nagtaas price point jollibee product galing galing inflation kakatuwa woooohooo,159,en
2087,2087,2022-09-05 10:32:56+00:00,1566736130988355585,"inflation is real.

skl. my friend from uk just arrived last week and as a pinoy, welcomed him like a true ofw -- kahit 12mos psot grad studies lang talaga un.

not surprised he went to jollibee for breakfast while i wfh. he bought me chickenjoy which is so sweet of him...",piqueroberos,inflation friend arrived pinoy welcomed study talaga surprised jollibee breakfast bought chickenjoy sweet,267,en
2093,2093,2022-09-02 09:05:47+00:00,1565627034201575424,"13.33% investment growth in less than 2 months? wow!

pildi ang 7% inflation rate. 👏🏻 https://t.co/w4xfofnvsn",itsniceKM,investment growth month pildi inflation,72,en
2097,2097,2022-09-01 00:02:12+00:00,1565127848863875079,"#howdidyousurvive high inflation?

i tried the local wet market in obando bulacan which is just a short bike ride away from my place and my gosh ang mura ng seafood and fruits! heaven!

#themorningrush",ayandeato,inflation tried local market obando bulacan short place seafood fruit heaven,164,en
2100,2100,2022-08-30 04:46:31+00:00,1564474624808992768,"➡️ https://t.co/tsok5l1vtk

📖 mbs threats

: unpredictable natural calamity will cause home prices inflation.

: nonpayment of securities by the borrowers will lead to the scarcity of mortgage backed securities.

: prepayment is a risk for residential mortgage backed securities",NeilEsqui2,threat unpredictable natural calamity cause price inflation nonpayment security borrower scarcity mortgage backed security prepayment residential mortgage backed security,242,en
2101,2101,2022-08-29 16:48:50+00:00,1564294014765244416,"mga taong struggled sa pinas with the inflation and having high rate of heinous crime

blengblong *enjoying to watch with gilas*

👊✌️❤️💚",Gatharmonyyy,taong struggled pinas inflation having heinous crimeblengblong enjoying watch,126,en
2103,2103,2022-08-23 15:08:38+00:00,1562094469280698368,di ko na din afford ang liomings wohooo inflation,mscelinestreets,afford liomings wohooo inflation,49,en
2104,2104,2022-08-22 13:42:36+00:00,1561710429126021122,@inquirerdotnet year 1990? juskooo hello inflation!,irenemaybiona1,juskooo hello inflation,31,en
2107,2107,2022-08-17 01:15:02+00:00,1559710360160325632,hindi kaya mas maraming urgent at bigger problem than this? shortage ng asukal? inflation? mataas na presyo ng gas? overpriced laptops ng deped? undistributed gadgets? priorities guys ba! priorities!,hafseu,maraming urgent bigger problem shortage asukal inflation mataas presyo overpriced laptop deped undistributed gadget priority priority,199,en
2109,2109,2022-08-14 04:02:45+00:00,1558665402947084288,monthly inflation is real. you can’t really feel your merit increase with it.,iamcenen,monthly inflation merit increase,76,en
2114,2114,2022-08-07 02:21:45+00:00,1556103271068352512,"@jcpunongbayan they have all the right to party.
na may pandemya pa, at tumataas ang infectivity rate, plus the problem on poverty and inflation ay minor details na lang 😅",tinzSantos,right party pandemya tumataas infectivity problem poverty inflation minor detail,153,en
2118,2118,2022-08-05 16:47:58+00:00,1555596486884589568,fcking inflation i should be on my way to the beach now.,PorkAdobo23,fcking inflation beach,56,en
2119,2119,2022-08-05 12:39:48+00:00,1555534031332450305,@rda47338427 shoot...supposedly the cure for inflation is recession. if we're already in a slow business recovery how much slower can we go.,M812Dindo,shoot supposedly inflation recession business recovery slower,127,en
2121,2121,2022-08-05 07:02:40+00:00,1555449191027027968,"6.4% yung inflation rate ng pinas but i have to disagree, we're not that high🤡🤪",cyril_balani,inflation pinas disagree,74,en
