,Unnamed: 0,Datetime,Tweet Id,Text,Username,Clean,Clean_Text_Length,Language
0,0,2023-03-01 23:55:00+00:00,1631080627062845440,"confident about the interventions set in place to cushion the impact of soaring food prices, president marcos rejected yesterday proposals for him to seek special powers to address inflation.

https://t.co/3a0pyzi0n6",PhilstarNews,confident intervention place cushion impact soaring price president marcos rejected proposal special power address inflation,191,en
1,1,2023-03-01 23:06:09+00:00,1631068335583444999,"@potus for starters, how about biden stops authorizing massive spending bills for the green agenda… this will help lower inflation and the national debt",conley_chuck,starter biden authorizing massive spending green agenda lower inflation national,144,en
2,2,2023-03-01 23:02:41+00:00,1631067460597170178,"president ferdinand marcos said there was no need for the house of representatives to grant special powers to curb inflation, adding that there are mechanisms that he can utilize to control the prices of commodities. /pdi https://t.co/1znjk1wzpp",inquirerdotnet,president ferdinand marcos house representative grant special power inflation adding mechanism utilize control price commodity,221,en
4,4,2023-03-01 22:50:55+00:00,1631064501704376323,@elgee35 does a great job explaining the nba's scoring inflation with some necessary historical context. https://t.co/kmobevnujf,ColonialMental,great explaining nba's scoring inflation necessary historical context,95,en
10,10,2023-03-01 21:28:33+00:00,1631043773055524864,@vilimsky first in inflation ;-) https://t.co/zgit5jzo09,BernhardZoidl,inflation,18,en
12,12,2023-03-01 21:20:00+00:00,1631041620241010690,"president ferdinand marcos jr. on wednesday said he does not need special powers to arrest inflation in the country.

full story: https://t.co/dcugsa096b",tribunephl,president ferdinand marcos wednesday special power arrest inflation country story,127,en
13,13,2023-03-01 19:47:26+00:00,1631018324774785024,"@danny_bayern @potus @vp biden created the most inflation in a 60 year history.

he wants to take away voting control from states and give it to big corporations (hr1).

he increased taxes on companies making products you buy, so they increased prices then gave 4.5 trillion tax dollars to big companies. https://t.co/4nklnfjhof",CharlesRingling,biden created inflation history voting control state corporation increased company making product increased price trillion dollar company,268,en
14,14,2023-03-01 19:43:01+00:00,1631017213250662400,"@potus @vp proud to have caused the highest inflation rate in 50 years as well as the greatest wealth inequality.

this is what the dnc does, then they lie about it. https://t.co/3fupyjl9ex",CharlesRingling,proud caused highest inflation greatest wealth inequality,149,en
15,15,2023-03-01 19:13:16+00:00,1631009726057140234,"@vortidude @trollstoy88 the airlines are currently being given hidden bailouts, this will increase the inflation , now china has opened up, the cost of travel will be 3-4x more expensive then flying with chinese airlines, finnair will be bankrupt soon",PapaDuvalier,airline currently given hidden bailouts increase inflation china opened travel expensive flying chinese airline finnair bankrupt,226,en
16,16,2023-03-01 19:01:28+00:00,1631006757819494400,@vulpulse idk either blame it to the inflation,kuroniemi,blame inflation,36,en
22,22,2023-03-01 16:22:17+00:00,1630966699687280646,@noliewithbtc bs!  the schools are the problem.  they charge exorbitant tuition and fees that far outpace inflation and the value of most degrees.  schools are non-regulated fat cats with no social responsibility.  schools should have to cosign student loans and be responsible for defaults.,joewp1,school problem charge exorbitant tuition outpace inflation value degree school regulated social responsibility school cosign student responsible default,273,en
27,27,2023-03-01 15:45:00+00:00,1630957315162611713,"marcos rejects proposal for more powers to address ph inflation

https://t.co/yjyik2pq0x",ABSCBNNews,marcos reject proposal power address inflation,63,en
28,28,2023-03-01 15:42:45+00:00,1630956749732847617,@fish_ishda @reyna_elena from october 2022 article..naproject na ang paglala ng food inflation even reaching &gt; 10% in dec 2022 and january  2023. vulnerable naman ang pinas sa food inflation pero nakokontrol naman sa acceptable level. unlike in the past 4months…tsk https://t.co/iy2uapt1ug,crux_sonata,october article naproject paglala inflation reaching january vulnerable naman pinas inflation nakokontrol naman acceptable level unlike monthstsk,224,en
29,29,2023-03-01 15:38:28+00:00,1630955671943516163,@philstarnews @alexisbromero wrong timing ngayon ang modernized jeepney where fuel prices are high plus inflation and jeepney drivers having hard time to make ends meet. dapat postpone muna.,gmdDiz,wrong timing modernized jeepney price inflation jeepney driver having postpone,161,en
30,30,2023-03-01 15:36:35+00:00,1630955199698292736,"president marcos says he doesn’t need to ask for special authority from congress to tackle 14-year high inflation. 
https://t.co/8fggkoijd4",MannySerapio,president marcos special authority congress tackle inflation,111,en
33,33,2023-03-01 15:13:04+00:00,1630949280008511488,"what a shame. with the inflation that continues to increase, plus with the shameful solution of the government on giving 1k subsidy, and then this jeepney phase out. how inconsiderate, how cruel, and very indifferent.",AyopHazen,shame inflation continues increase shameful solution government giving subsidy jeepney phase inconsiderate cruel indifferent,216,en
38,38,2023-03-01 14:32:57+00:00,1630939183643602944,analysts expect pakistan's inflation rate to continue rising in the coming months. https://t.co/nav2ajdpvp,rapplerdotcom,analyst expect pakistan's inflation continue rising coming month,82,en
39,39,2023-03-01 14:32:09+00:00,1630938982329753600,philippine president ferdinand marcos jr. rejected a lawmaker's proposal to grant him special powers to combat the country's rising inflation. https://t.co/ggicb1mltg,ANCALERTS,philippine president ferdinand marcos rejected lawmaker's proposal grant special power combat country's rising inflation,142,en
42,42,2023-03-01 14:17:54+00:00,1630935397281718273,"what a peculiar statement ...

wage inflation is above cpi https://t.co/8g6pubiidt",ZARTechnical,peculiar statement inflation,56,en
47,47,2023-03-01 13:04:30+00:00,1630916925206458370,"they're back... 9 months of backsliding... build build build projects has been scrapped, crimes up, drugs are back on the streets, inflation has been uncontrolled, agriculture spiraled to an abyss... foreign pasyal has not produced a centavo... olats si leni!",davetabuena,month backsliding build build build project scrapped crime street inflation uncontrolled agriculture spiraled abyss foreign pasyal produced centavo olats,257,en
49,49,2023-03-01 12:50:14+00:00,1630913334881943552,"world #stocks recovered on wednesday after manufacturing activity in china grew at its fastest pace in more than a decade,while stronger-than-expected inflation rates across the eurozone hurt government bonds.

get the latest stock market insights with our analyst ratings module https://t.co/ovixh9bdix",neptun_ai,world recovered wednesday manufacturing activity china fastest decade stronger expected inflation eurozone government latest stock market insight analyst rating module,269,en
50,50,2023-03-01 12:47:59+00:00,1630912767401279491,"i would be happy if those people who voted for him will ask for accountability. the question should be, as a filipino, how would you hold them accountable for the soaring prices due to inflation in your country? it doesn't matter anymore kung sino binoto mo. nandiyan na eh. ask!",anggiandako,happy people voted accountability question filipino accountable soaring price inflation country matter anymore binoto nandiyan,279,en
53,53,2023-03-01 12:22:05+00:00,1630906251990433794,"inflation is due to both systemic issues and policies. a restrictive, inefficient, and ineffective system contributes to inflation, regardless of leadership quality. solving inflation requires addressing systemic issues and promoting an efficient, open economy.",ARC7IT3CT,inflation systemic issue policy restrictive inefficient ineffective system contributes inflation regardless leadership quality solving inflation requires addressing systemic issue promoting efficient economy,261,en
54,54,2023-03-01 12:20:21+00:00,1630905815203987458,"@abscbnnews a system that is ineffective, inefficient, and heavily restrictive can create an environment where inflation is more likely to occur, regardless of the quality of leadership. open the economy, limit the restriction, change the system.",ARC7IT3CT,system ineffective inefficient heavily restrictive create environment inflation likely occur regardless quality leadership economy limit restriction change system,234,en
56,56,2023-03-01 12:00:49+00:00,1630900898510835712,@jclem3 and even if the collected amount will be higher the value of that amount will probably the same or lower due to inflation.  tsz.,monm_,collected higher value probably lower inflation,127,en
57,57,2023-03-01 12:00:02+00:00,1630900700312895488,"despite the economic climate being challenged by high inflation rates and other macroeconomic factors, the gotianun-led fli remains bullish in 2023 encouraged by the resilience of businesses and the continued support of their customers.

know more: https://t.co/gjrsqh7vfu https://t.co/0cnleaakb6",BusinessMirror,despite economic climate challenged inflation macroeconomic factor gotianun remains bullish encouraged resilience business continued support customer,241,en
60,60,2023-03-01 11:43:51+00:00,1630896629883752448,"but in financially trying times, especially with our inflation rate transcending past expectations, she advised us to sacrifice our 20% if need be and aim to preserve our 30% savings as our safety net.",upaes_,financially trying especially inflation transcending expectation advised sacrifice preserve saving safety,197,en
61,61,2023-03-01 11:43:48+00:00,1630896617615421440,"https://t.co/e6tzcmle9v

🗣 inflation is so high, may savings ka pa ba?!

our next two-on-one interview is with financial advisor kristelle anne viray-aurelio providing us with some tips and tricks on how to save. 💰",upaes_,inflation saving interview financial advisor kristelle viray aurelio providing trick,183,en
65,65,2023-03-01 11:28:34+00:00,1630892784134639616,"@baerevo_ @frankdegods well points as far as i have heard different speculations, might be used for some irl stuff, and more points out there with the holders will make value of each point less worth than what they would be with the current system. more points in circulation will have higher inflation",dazzigar,point heard different speculation stuff point holder value point worth current system point circulation higher inflation,279,en
66,66,2023-03-01 11:15:01+00:00,1630889374048198656,"headline inflation may have breached the 9% level in february, amid higher prices of cooking gas, pork, fish, and eggs, the bangko sentral ng pilipinas (bsp) said on tuesday. https://t.co/wudy8qbkt2 https://t.co/edvfqurgda",bworldph,headline inflation breached level february higher price cooking bangko sentral pilipinas tuesday,173,en
67,67,2023-03-01 11:08:31+00:00,1630887735459475456,"tune down the logic, and be empathetic for once. do we want wages, though one of the main drivers of inflation, to go down in order to make things more affordable? imo, house, rent, car prices, among others should be the focus to drive #inflation down",DoveHawkin,logic empathetic driver inflation order thing affordable going house price focus drive,240,en
69,69,2023-03-01 10:52:49+00:00,1630883784454451200,"@jackassdeleon sa bank may option din na variable interest ang piliin mo rather than fixed. however in a high inflation economy likes ours atm, expect interest rates to be jacked up. in a good economy naman.. sulit na sulit ang variable interest",croelintentions,option variable interest piliin fixed inflation economy expect interest jacked economy naman sulit sulit variable interest,230,en
72,72,2023-03-01 10:26:34+00:00,1630877181336494083,the department of budget and management (dbm) ensured allocations for programs that will serve as near-term and long-term interventions to help address inflation. https://t.co/5kgzen3kvf,DBMgovph,department budget management ensured allocation program serve intervention address inflation,162,en
74,74,2023-03-01 10:16:33+00:00,1630874657183399936,"&amp;#8216;mataas lahat&amp;#8217; | filipinos likely to face continued high inflation this year, says economist - https://t.co/itntmwzs5m",Izydro,mataas filipino likely continued inflation economist,98,en
76,76,2023-03-01 10:12:38+00:00,1630873671182217216,"‘martyr or murderer’ saw some impressive sales today but it's noticeably lower than ‘maid in malacañang’. this is very clear particularly on the major malls in metro manila.

again, election fever dying down &amp; inflation could be hurting the film #momnowshowing #martyrormurderer",CBO_channel,martyr murderer impressive noticeably lower malacaang clear particularly major metro manila election fever dying inflation hurting,239,en
77,77,2023-03-01 09:53:41+00:00,1630868903978217472,@jclem3 due to inflation will only affect the formal economic transactions thus taxes from this sector will surely dwindle to levels unacceptable hence the need to always curb inflation instead of allowing it to run berserk as it is now.,jelbacon,inflation affect formal economic transaction sector surely dwindle level unacceptable inflation instead allowing berserk,229,en
78,78,2023-03-01 09:51:32+00:00,1630868365240590338,"president ferdinand r. marcos jr. on wednesday said there is no need to ask congress for special powers to address inflation, saying his administration has initiated interventions to mitigate its debilitating effects. | https://t.co/hbvzrqlqo0 https://t.co/da86vqor8n",radyopilipinas1,president ferdinand marcos wednesday congress special power address inflation saying administration initiated intervention mitigate debilitating effect,219,en
81,81,2023-03-01 09:45:51+00:00,1630866933871439872,"asia’s factory activity stalled in february with the exception of china, as slowing global demand, stubbornly high inflation and the fallout from past interest rate hikes weighed on the region’s economies, surveys showed. | @reuters https://t.co/pmqeqits32",inquirerdotnet,factory activity stalled february exception china slowing global demand stubbornly inflation fallout interest weighed region economy survey showed,221,en
84,84,2023-03-01 09:36:45+00:00,1630864643404238850,@mongramosjr @choi_kapitan @bongbongmarcos wc as we all know is not sustainable without a fool proof program addressing inflation - either wala pa tlaga o meron na pero di ginagawa ni pcoo trabaho nila,CarlosAKatigbak,sustainable proof program addressing inflation tlaga meron trabaho,158,en
85,85,2023-03-01 09:25:11+00:00,1630861731965673473,"president ferdinand ""bongbong"" marcos jr. said wednesday that he does not see the need for special powers to address the rising inflation.

read: https://t.co/lh4obnkayq
📰gma news online https://t.co/ht5t6euywz",nowyouknowph,president ferdinand bongbong marcos wednesday special power address rising inflation online,155,en
88,88,2023-03-01 08:56:08+00:00,1630854422833266689,taking and accpeting all the free food here in the office kasi grabe. 9.3% na ang inflation naten hhahahah 🤣 https://t.co/4nfhohikox,archieiology,taking accpeting office inflation naten hhahahah,103,en
90,90,2023-03-01 08:45:47+00:00,1630851815372738560,"australia’s economy grew at the weakest pace in a year last quarter as strength in trade was offset by rising interest rates and high inflation, and all the signs are a further slowdown lies ahead. | @reuters https://t.co/79ym4twue8",inquirerdotnet,australia economy weakest quarter strength trade offset rising interest inflation slowdown ahead,198,en
91,91,2023-03-01 08:45:00+00:00,1630851618228035584,"national economic and development authority secretary arsenio m. balisacan has reiterated the government's commitment to managing inflation and ensuring the sustained growth of the country's economy, despite challenges in both local and global markets.

https://t.co/u3kpsdsqdh",advocatesph,national economic development authority secretary arsenio balisacan reiterated government's commitment managing inflation ensuring sustained growth country's economy despite challenge local global market,252,en
93,93,2023-03-01 08:26:38+00:00,1630846998541926400,"we're not even a year past and we're already heading to a 10% inflation rate??? tsk sana may discount card mga bills, di ba? 🤦‍♀️",crystaladc_,heading inflation discount,122,en
98,98,2023-03-01 07:40:00+00:00,1630835260421283840,"ph's inflation rate in february seen to peak at 9.3%

read: https://t.co/qvigcfjsip",dzrhnews,inflation february,54,en
99,99,2023-03-01 07:31:04+00:00,1630833013776060416,"rodriguez:(1) imperative to a sustained economy: urgently needed and vital to our economy: and a long-term term solution to the present problems faced by our country today such as inflation, lack of jobs and competition in various industries;",RG_Cruz12479,rodriguez1 imperative sustained economy urgently needed vital economy solution present problem faced country inflation competition industry,240,en
105,105,2023-03-01 07:09:22+00:00,1630827553400451072,"in times of economic crises, raising wages via ""legislative fiat"" is a must. workers are suffering from record inflation rates and price caps are generally failing. people can't live on loans.laki sweldo ng mga burukrata kaya manhid sa sitwasyon ng manggagawa at ayaw sa wage hike",dmmsanjuan,economic crisis raising legislative worker suffering record inflation price generally failing people sweldo burukrata manhid sitwasyon manggagawa,280,en
106,106,2023-03-01 07:05:58+00:00,1630826698605305856,"@calebfranzen nice gift! i gave my son a 50,000,000 reichsmark note to teach him about inflation.",Thomas__Wehling,reichsmark teach inflation,72,en
108,108,2023-03-01 07:01:04+00:00,1630825463193976832,"@mavix_leon @privatekonomen @vienna13capital kzt quite strong. alleviates the local inflation. mkt positive for more liquidity in the stock. not sure where you (and they) get the pe numbers from. at least for 23, at $75, i get 8.25x ish. $14.2b mcap vs $1.7b ni (2022 * 1.25) 🤷🏻‍♂️ https://t.co/cmcfj6hmhq",Trisseswe,strong alleviates local inflation positive liquidity stock number,220,en
109,109,2023-03-01 07:00:00+00:00,1630825194771320832,@jclem3 @ancalerts higher inflation means more expensive goods and services. meaning less spending/buying power for everyone except the rich. how does that equal more vat when can’t buy more? help me out here ‘cause i don’t get what she’s saying.,maccaburian,higher inflation expensive service meaning spending buying power equal saying,223,en
110,110,2023-03-01 06:55:59+00:00,1630824185759952896,"e di gamitin mo ang kapangyarihan mo.

pbbm: ""i have the power to control prices of consumer products to address 9.3% inflation; currently at a 14-year high.""

https://t.co/4pwhacedrj via @bpolitics",jnpangilinan79,gamitin kapangyarihan power control price consumer product address inflation currently,155,en
111,111,2023-03-01 06:36:42+00:00,1630819330559741961,@inquirerdotnet alleviate poverty and inflation. yun ang main problem. doon nyo ibuhos ang effort nyo.,ChesMike_G,alleviate poverty inflation problem ibuhos effort,86,en
112,112,2023-03-01 06:36:26+00:00,1630819263631228929,"@jclem3 @ancalerts actually mali padin as in economics we use the laffer curve for optimization ng tax collection

if inflation increases, then yes per transaction higher tax but overall volume goes down

so if inflation goes up, you actually need to lower tax to keep the volume of transactions",DJKAZWAL,actually padin economics laffer curve optimization collectionif inflation increase transaction higher overall volume downso inflation actually lower volume transaction,272,en
113,113,2023-03-01 06:33:01+00:00,1630818404985901056,"energy columns in businessworld: ten trends in inflation, ppp, employment, energy, https://t.co/gwnswiglng",Noysky,energy column businessworld trend inflation employment energy,82,en
117,117,2023-03-01 06:22:32+00:00,1630815766240178182,"if the government can't control the inflation, spin it. hehe! sakit sa bangs. this is not it madame. 😅✌️",nakngtweeting,government control inflation sakit madame,100,en
119,119,2023-03-01 06:19:41+00:00,1630815048774868994,"president ferdinand marcos jr. is not keen on being granted special powers to curb inflation, saying the move is unnecessary. https://t.co/jtrt02c2df",cnnphilippines,president ferdinand marcos granted special power inflation saying unnecessary,125,en
123,123,2023-03-01 05:57:21+00:00,1630809427707314176,@dochappy95 depende kung anong i mamarcha. wag inflation mag forward march. 🤔,KalbongSingkit,depende anong mamarcha inflation forward march,63,en
124,124,2023-03-01 05:57:03+00:00,1630809355024232448,"president ferdinand ""bongbong"" marcos jr. on wednesday said there is no need to ask congress for special powers to curb inflation.

read more:
https://t.co/mnxdxwfy04 https://t.co/dccuorrodh",TheManilaTimes,president ferdinand bongbong marcos wednesday congress special power inflation,140,en
126,126,2023-03-01 05:21:18+00:00,1630800358472548352,"there is no need to ask for special powers to ease inflation, president ferdinand marcos jr. said wednesday, noting that several interventions are already in place to manage the prices of basic commodities.

https://t.co/j2sspygndb",pnagovph,special power inflation president ferdinand marcos wednesday noting intervention place manage price basic commodity,206,en
127,127,2023-03-01 05:15:37+00:00,1630798924905861120,"📌 central luzon's inflation rate, january 2023 (2018 = 100) 📌

read more: https://t.co/smhyftqswc https://t.co/lnwml18ctq",PSA_RSSO3,central luzon's inflation january,60,en
130,130,2023-03-01 05:11:22+00:00,1630797857841364992,"📌 central luzon's inflation rate, consumer price index (cpi) and purchasing power of peso (ppp), january 2023 (2018 = 100) 📌

read more: https://t.co/smhyftqswc https://t.co/ghsywiju4u",PSA_RSSO3,central luzon's inflation consumer price index purchasing power january,123,en
131,131,2023-03-01 05:07:25+00:00,1630796861618679808,"government and taxes: bworld 584, ten trends in inflation, ppp, employment, cancer treatment and energy, https://t.co/ls1ca3vygl",Noysky,government bworld trend inflation employment cancer treatment energy,101,en
132,132,2023-03-01 05:03:34+00:00,1630795894575759361,have done is to propose measures to bring down inflation rate to the reasonable projected level. it seems the economic team is already clueless in what monetary measures to implement. go after smugglers and hoarders now!,babystepsparrow,propose measure bring inflation reasonable projected level economic clueless monetary measure implement smuggler hoarder,220,en
137,137,2023-03-01 04:47:09+00:00,1630791761818963971,"marcos: no need for special powers to curb inflation

https://t.co/igtaxcbsbc",TheManilaTimes,marcos special power inflation,52,en
138,138,2023-03-01 04:44:20+00:00,1630791055460405248,"pero inflation is still rising, and is in fact at a 14-year high. 🤷‍♂️",jcpunongbayan,inflation rising,63,en
139,139,2023-03-01 04:37:43+00:00,1630789389608685568,"(4/6) 🧵®️ real yield

holders receive compensation despite inflation.

consider product revenue or profit sharing instead. for example, stakers receive all. on @lancelottools platform fees from zk limit &amp; stop loss orders on camelot | generalized swap, which equals real yield. https://t.co/awhinhdjxz",Thornft_art,yieldholders receive compensation despite inflation consider product revenue profit sharing instead example stakers receive platform limit order camelot generalized equal yield,255,en
141,141,2023-03-01 04:36:28+00:00,1630789075895562240,"'not necessary' 

president ferdinand marcos jr. does not see the need for additional powers to curb inflation as proposed by a house lawmaker. 

read: https://t.co/qhmxea1acg https://t.co/7i56n0cv33",ANCALERTS,necessary' president ferdinand marcos additional power inflation proposed house lawmaker,146,en
143,143,2023-03-01 04:27:33+00:00,1630786829048791040,"legarda rejects fresh moves to amend the 1987 constitution, saying lawmakers should focus instead on solving inflation, poverty and unemployment. https://t.co/sapmswou2m",ANCALERTS,legarda reject fresh amend constitution saying lawmaker focus instead solving inflation poverty unemployment,140,en
150,150,2023-03-01 04:04:16+00:00,1630780968943640578,neda maintains resolve over government inflation management https://t.co/uiy3cxf2ar,ph_current,maintains resolve government inflationmanagement,58,en
152,152,2023-03-01 04:00:01+00:00,1630779899345797120,"inflation likely remained stubbornly high and could have breached nine percent in february from a fresh 14-year high of 8.7 percent in january, according to the bangko sentral ng pilipinas (bsp). 
https://t.co/iyi2qa7fnx",PhilippineStar,inflation likely remained stubbornly breached february fresh january according bangko sentral pilipinas,189,en
