,Unnamed: 0,Datetime,Tweet Id,Text,Username,Clean,Clean_Text_Length,Language
972,972,2023-02-21 18:00:02+00:00,1628092196766244866,"govt focusing on aid to poor, vulnerable amid high inflation: neda https://t.co/v05qqexsys",ABSCBNNews,focusing vulnerable inflation,66,en
973,973,2023-02-21 17:49:03+00:00,1628089429398024192,"@potus kyiv is standing with death of thousands of people; migration of millions of people; girls/women being raped in unknown land and no one reports it. anyway, you are falling &amp; failing even without all of above happening to you. have a look at ohio, inflation, deficits… 🙏",investingsadhu,standing death thousand people migration million people woman raped unknown report falling failing happening inflation deficit,267,en
974,974,2023-02-21 17:30:00+00:00,1628084636936200192,"the increase in inflation assistance for senate employees is fruit of their decades-long call to the government body, their union said, as they also called for higher benefits and aid for all workers nationwide amid rapidly rising living costs. https://t.co/srfgn8yusr",PhilippineStar,increase inflation assistance senate employee fruit decade government union called higher benefit worker nationwide rapidly rising living,244,en
975,975,2023-02-21 17:29:31+00:00,1628084514206658560,"the fact that the senate will provide inflation bonuses to their employees means they acknowledge and understand that filipinos need inflation bonuses.

why is there no discussion on finding a way to extend the same benefit to everyone?",alrstr,senate provide inflation bonus employee acknowledge understand filipino inflation bonus discussion finding extend benefit,234,en
977,977,2023-02-21 17:15:50+00:00,1628081074034323457,meanwhile..senate employees receive 50k inflation assistance🤔🤔🤔👏👏👏,ichuichu03,senate employee receive inflation assistance,58,en
978,978,2023-02-21 17:07:38+00:00,1628079008280719365,"@btc_archive 2 years from now:

""there's no evidence that 8% or 10% inflation does substantial damage relative to 5% inflation.""

save yourself. save your family. buy real money and real property, buy #bitcoin",rizzo___,evidence inflation substantial damage relative inflation family money property,177,en
979,979,2023-02-21 16:28:31+00:00,1628069165528678400,"@harryjsisson by being a warmonger, arresting people who have evidence of your sexual abuse of your own daughter, have the fbi go after evidence of corruption, using extortion on world leaders openly, pushing a party authoritarian dictatorship, causing inflation &amp; greater inequality.",CharlesRingling,warmonger arresting people evidence sexual abuse daughter evidence corruption extortion world leader openly pushing party authoritarian dictatorship causing inflation greater inequality,271,en
980,980,2023-02-21 16:25:00+00:00,1628068278147993600,"walmart reported better-than-expected profits over the critical holiday-season quarter tuesday, but offered a disappointing outlook as inflation weighs on consumers. #bilyonaryofood
https://t.co/a3jc4lclmi",bilyonaryo_ph,walmart reported better expected profit critical holiday season quarter tuesday offered disappointing outlook inflation weighs consumer,169,en
981,981,2023-02-21 16:07:00+00:00,1628063748530249731,"the distribution of inflation assistance to poor families and government workers has not been discussed in the executive branch, neda secretary arsenio balisacan said tuesday.

https://t.co/mivurdvcda",gmanews,distribution inflation assistance family government worker discussed executive branch secretary arsenio balisacan tuesday,175,en
982,982,2023-02-21 16:01:28+00:00,1628062355564408833,plenty of everything in the philippines... including inflation...8%. https://t.co/y056mmsaqp,PABC1960,plenty philippine including inflation,68,en
983,983,2023-02-21 16:01:07+00:00,1628062269732007936,"think you can’t make a gift due to inflation and the economy? 
think again! there are many ways you can make a gift to support navian hawaii, despite inflationary and financial concerns. we would be pleased to provide assistance: development@navianhawaii.org or (808) 924-9255. https://t.co/vgxtbnyrt0",NavianHawaii,think inflation economy think support navian hawaii despite inflationary financial concern pleased provide assistance development,259,en
984,984,2023-02-21 15:49:12+00:00,1628059269139681280,"fox business...dow drop nears 500 points, home depot sinks.
home depot warned of flat sales in 2023 amid persistent inflation. the gloomy outlook is weighing on the broader stock market.",GarySonnyChiba,business nears point depot depot warned persistent inflation gloomy outlook weighing broader stock market,176,en
989,989,2023-02-21 15:17:59+00:00,1628051412163891201,@pictures2music @zhao_dashuai @mfa_russia you can't win against us . lithuania already k.o under china sanctions . with 22% inflation🤡🤡🤡 cry hard clown,tylor_bridge,lithuania china sanction inflation clown,104,en
994,994,2023-02-21 14:18:56+00:00,1628036554966056960,inflation is making me crazy,tryhardsunshine,inflation making crazy,28,en
1003,1003,2023-02-21 13:54:18+00:00,1628030354161569792,@itsme_jimsygale inflation is real na jud. hope the sauce is still the same taste like i remember during med.,AngkolMD,inflation sauce taste remember,92,en
1007,1007,2023-02-21 13:02:10+00:00,1628017235485925377,tight value friday and coiling now - move could be a brewing.  fed minutes weds and another inflation gage on friday.,LarryLi56652974,tight value friday coiling brewing minute inflation friday,116,en
1011,1011,2023-02-21 11:43:21+00:00,1627997401113067521,"luh may inflation assistance???
since when??? tska bat kayo lang?",HAnaPPYkim,inflation assistance,64,en
1012,1012,2023-02-21 11:39:30+00:00,1627996432023326720,"february 20, 2023

done my first ever interviewer experience. 
ang hirap mag hanap ng employee na papatos sa entry level na salary sa ganitong times. inflation pa biiiiiii.

nagka preview sa future disappointments na mapi-feel ko in the next few weeks. hahahahahahaha",dyesuhhhh,february interviewer experience hirap hanap employee papatos entry level salary ganitong inflation biiiiiii nagka preview future disappointment hahahahahahaha,256,en
1018,1018,2023-02-21 11:10:00+00:00,1627989008658694145,"the alliance of concerned teachers-national capital region union on tuesday requested to increase the educators’ personnel economic relief allowance from the current php2,000 to php5,000 amid inflation pressures. https://t.co/thriu4mcla",pnagovph,alliance concerned teacher national capital region union tuesday requested increase educator personnel economic relief allowance current inflation pressure,211,en
1019,1019,2023-02-21 11:07:52+00:00,1627988471070752769,@lesfox_ph inflation gamay but it's still relatively affordable,dkrgalindo,inflation gamay relatively affordable,52,en
1021,1021,2023-02-21 11:02:13+00:00,1627987046567448578,bsp expected to implement more rate  hikes due to elevated inflation: fitch https://t.co/yuzfgjo9dj,EdgeDavao,expected implement elevated inflation fitch,74,en
1024,1024,2023-02-21 10:58:05+00:00,1627986010054488064,"they want an inflation rate assistance? then tataas nanaman ung tax kasi andmi nnmn utang?? aigoooo 

maybe sa mga indigent or those who really need it... pero idk if it should be for everyone🤔🤔",peach_j0,inflation assistance tataas nanaman andmi utang aigoooo maybe indigent,190,en
1025,1025,2023-02-21 10:48:37+00:00,1627983625349365760,"just came back from the grocery. nakakastress! ang 1 doz eggs 135 na from 99 before, 500ml cooking oil 70 na from 50, 2l milk 160 from 130 before. all the usual items we get nagmahal na. sana all may inflation allowance!😭 

may gobyerno pa ba tayo?",dafeyn,grocery nakakastress cooking usual nagmahal inflation allowance gobyerno,219,en
1028,1028,2023-02-21 10:37:23+00:00,1627980800569520128,talaga naman ang priority...may solution sa internet connection pero sa inflation wala!!!🤔😂 the best ka talaga 😞,dtapec63,talaga naman priority solution internet connection inflation talaga,108,en
1034,1034,2023-02-21 10:06:32+00:00,1627973036157849600,"the banking sector has stood the test,turning a profit, inflation is under control
the banking sector has withstood the attack and looks like it will win. let us all endure and win!
necessary to strengthen deoffshorization of economy,business must operate in russian jurisdiction.",enfree1993,banking sector stood turning profit inflation controlthe banking sector withstood attack endure necessary strengthen deoffshorization economy business operate russian jurisdiction,278,en
1035,1035,2023-02-21 10:02:06+00:00,1627971919575408640,"@mrsgonzales2018 the cannabis question is not anymore important than inflation, just as inflation is not anymore important than cannabis. the legislature can tackle all of these at the same time. ever heard of multitasking?",jobbautista9,cannabis question anymore important inflation inflation anymore important cannabis legislature tackle heard multitasking,206,en
1036,1036,2023-02-21 10:00:00+00:00,1627971391365455873,"inflation assistance for senate workers 'just and right'

senate employees' union senado said the increased inflation assistance to p50,000 from the previous p12,000 was due to their call for higher benefits because their wages barely sustain a living https://t.co/cvsz9xbff3",PhilstarNews,inflation assistance senate worker 'just right'senate employees' union senado increased inflation assistance previous higher benefit barely sustain living,249,en
1039,1039,2023-02-21 09:52:50+00:00,1627969588863602690,"there is, so far, no discussion on whether or not the government would duplicate the senate’s inflation relief aid to its employees in the executive department and to the public.
 https://t.co/rxxryk4v9f",manilabulletin,discussion government duplicate senate inflation relief employee executive department public,177,en
1041,1041,2023-02-21 09:44:20+00:00,1627967449927929861,"@jmschumey each and every filipino is entitled to inflation assistance and not for a selected government employees. we breathe the same air and spend the same currency in this country and how they are different, iba naba ang value ng pera ng senado? @senateph @migzzubiri",saudiboy2,filipino entitled inflation assistance selected government employee breathe spend currency country different value senado,238,en
1042,1042,2023-02-21 09:43:30+00:00,1627967237746462720,"...they are trying to use communications to stop our communications, our finances, and to invoke inflation...and to make our people suffer...they wanted to destabilise our society.""",olliekarp,trying communication communication finance invoke inflation people suffer wanted destabilise society,181,en
1044,1044,2023-02-21 09:30:52+00:00,1627964057524531202,"@harveyvore_ and if inflation affects everybody, then why only the senate employees are provided protection?",ericnera,inflation affect everybody senate employee provided protection,95,en
1045,1045,2023-02-21 09:28:21+00:00,1627963427330347008,"wait... wait...
aren't we all affected by inflation? or that was just my imagination? 🤔😱",Msjosephine8,affected inflation imagination,84,en
1049,1049,2023-02-21 09:04:16+00:00,1627957363582939136,point of view: anxiety in inflation https://t.co/zyjv91dks5,ayahmdee13,point anxiety ininflation,34,en
1050,1050,2023-02-21 09:02:45+00:00,1627956985495969793,"growing global trend that the #service sector is still the primary focus as an #inflation driver.

#euro services pmi https://t.co/vmrd9bgsmp",mytsarmiento,growing global trend sector primary focus driver service,90,en
1055,1055,2023-02-21 08:54:05+00:00,1627954804206243840,"neda said the government has ""limited fiscal space"" and thus is focusing on aid for the poor and vulnerable sectors amid elevated inflation. https://t.co/atnlev1ewm",ANCALERTS,government limited fiscal space focusing vulnerable sector elevated inflation,140,en
1056,1056,2023-02-21 08:53:24+00:00,1627954631241498625,"humirit si house assistant minority leader arlene brosas ng inflation assistance para sa ordinaryong mga manggagawa. | ulat ni kathleen jean forbes

basahin: https://t.co/wyuxxlwor3 https://t.co/zhmgsp2ard",radyopilipinas1,humirit house assistant minority leader arlene brosas inflation assistance ordinaryong manggagawa kathleen forbesbasahin,155,en
1057,1057,2023-02-21 08:51:28+00:00,1627954144203116544,inflation assistance plsss,leariza,inflation assistance plsss,26,en
1059,1059,2023-02-21 08:40:00+00:00,1627951260195336194,"senate raises staff’s inflation stipend to p50k 

read more: https://t.co/gnc0jduzg2",MlaStandard,senate raise staff inflation stipend,57,en
1060,1060,2023-02-21 08:29:56+00:00,1627948725329952768,@bbcbreaking pay all nhs staff an above inflation payrise so they can make ends meet each month,drip_freak,staff inflation payrise month,82,en
1062,1062,2023-02-21 08:20:29+00:00,1627946345897263104,"my point is, we can play charades on how walmart would beat revenues and earnings tonight. we can adjust and pass thru prices to our customers. we can continue to keep the high inflationary prices passed on. the 4% avg revenue growth is easy to beat if inflation is 6% +anyway.",FacelessTrader,point charade walmart revenue earnings tonight adjust price customer continue inflationary price passed average revenue growth inflation +anyway,275,en
1063,1063,2023-02-21 08:19:25+00:00,1627946076442398721,"australia’s central bank, startled by the risk that inflation could prove stickier than previously thought, abandoned all thought of pausing at its february policy meeting and signalled more rate hikes would be needed in the months ahead. | @reuters https://t.co/jmdxdexlbj",inquirerdotnet,australia central startled inflation prove stickier previously thought abandoned thought pausing february policy meeting signalled needed month ahead,239,en
1066,1066,2023-02-21 08:11:55+00:00,1627944190138097664,senate employees to receive one-time p50k inflation allowance https://t.co/icmbwyelfs,ph_current,senate employee receive inflationallowance,60,en
1067,1067,2023-02-21 08:11:25+00:00,1627944066976710664,i'm surprised that they're more concerned about this rather than the inflation rate in the country. ung sibuyas ginto pa rin. anuna?,sphyxiation_,surprised concerned inflation country sibuyas ginto anuna,132,en
1072,1072,2023-02-21 07:44:57+00:00,1627937402907144192,"@sellyfans96 have u seen the inflation rate, it's crazy!",UltraShithole,inflation crazy,43,en
1074,1074,2023-02-21 07:40:00+00:00,1627936157630619649,"share prices fell for the fourth straight week after the bangko sentral ng pilipinas (bsp) raised its rates by 50 basis points, but analysts said this was expected as inflation accelerated in january.

know more: https://t.co/4yvdlh7rgk https://t.co/yvf2lkzztw",BusinessMirror,share price fourth straight bangko sentral pilipinas raised basis point analyst expected inflation accelerated january,207,en
1079,1079,2023-02-21 06:47:52+00:00,1627923038523248640,"senate union asked for the inflation ayuda. union works.

sana maging pro-labor and pro-union ulet ang labor code and ang pilipinas. but we have capitalist legislators.",jesusfalcis,senate union asked inflation ayuda union labor union labor pilipinas capitalist legislator,166,en
1082,1082,2023-02-21 06:39:51+00:00,1627921022723973120,"@pingpingtweets @desamting @migzzubiri @senateph while i agree that other frontliners also deserve a corresponding raise to meet inflation, that does not mean that senate staff should suffer belittlement and denigration from the general public for this decision. /2.",simounsez,agree frontliners deserve corresponding raise inflation senate staff suffer belittlement denigration general public decision,217,en
1083,1083,2023-02-21 06:31:44+00:00,1627918978764144640,"for the final finish, let’s hope that $wmt which reports today before markets open issues a very bleak guidance as a result of high inflation impacting us consumers.  it will be an interesting 2/21/2023 indeed. carl icahn 4050 puts are ready!",FacelessTrader,final finish report market issue bleak guidance result inflation impacting consumer interesting icahn ready,234,en
1085,1085,2023-02-21 06:15:01+00:00,1627914773601058816,balisacan: we are hoping that we see a plateau in inflation. we are expecting better data there but there are always surprises. | via @azereraser_pna,pnagovph,balisacan hoping plateau inflation expecting better surprise,133,en
1086,1086,2023-02-21 06:09:21+00:00,1627913347122475010,"@luigialmario i look at you and i conclude that inflation of good looks is a real thing, pawe",axlrosstumanut,conclude inflation thing,79,en
1088,1088,2023-02-21 06:00:18+00:00,1627911068897972225,wall street closed another bumpy week with a mixed performance on friday amid worries that inflation is not cooling as quickly or as smoothly as hoped. https://t.co/mbqjamxsrq,TheFinancialD,street closed bumpy mixed performance friday worry inflation cooling quickly smoothly hoped,151,en
1090,1090,2023-02-21 05:56:30+00:00,1627910113926467585,"correction

balisacan: we are hoping that we see a plateau in inflation. we are expecting better data there but there are always surprises. @pnagovph",azereraser_PNA,correctionbalisacan hoping plateau inflation expecting better surprise,137,en
1092,1092,2023-02-21 05:54:04+00:00,1627909498420760577,"neda sec. balisacan on ph inflation: we are hoping that we'll see a plateau already of the inflation… it’s our hope, kasi february, march, that’s harvest season for farmers, and we did not have any major typhoons during the last few months. so we are expecting better data.",cnnphilippines,balisacan inflation hoping plateau inflation february march harvest season farmer major typhoon month expecting better,270,en
1095,1095,2023-02-21 05:41:30+00:00,1627906337094131715,"neda sec. balisacan: for those na affected adversely, ‘yun ang pagbuhusan natin ng assistance. hindi feasible na lahat naman ay pare-pareho ang treatment… so ‘yung approach natin, [to] make sure we are able to address ‘yung inflation.",cnnphilippines,balisacan affected adversely pagbuhusan natin assistance feasible naman treatment approach natin address inflation,230,en
1096,1096,2023-02-21 05:41:16+00:00,1627906277686013954,q: will gov’t roll out an ‘inflation assistance’ similar to the senate’s move? https://t.co/pquxh6yxvv,cnnphilippines,inflation assistance similar senate,74,en
1097,1097,2023-02-21 05:40:56+00:00,1627906195674763264,"balisacan on whether rcep will help tame inflation: when we say we join rcep, it does not mean tomorrow we benefit already. | via @azereraser_pna",pnagovph,balisacan inflation benefit,129,en
1098,1098,2023-02-21 05:39:03+00:00,1627905721466753024,"@hellokidneymd @itsy0l0 well, economically weird un. hahaha

kasi magkakaiba cost of living and ung unintended consequence is inflation sa provinces

cheap labor sa provinces is the incentive for companies to set up there, take it away and companies will just focus more on ncr",DJKAZWAL,economically weird hahahakasi magkakaiba living unintended consequence inflation provincescheap labor province incentive company company focus,249,en
1099,1099,2023-02-21 05:37:18+00:00,1627905281295515648,"@helenmflores balisacan says providing ""inflation"" assistance to employees in the executive branch not feasible. | @helenmflores 

live: https://t.co/mymfwxt2m8",PhilippineStar,balisacan providing inflation assistance employee executive branch feasible,106,en
1104,1104,2023-02-21 05:31:31+00:00,1627903823342862336,balisacan said they are trying to address high inflation by boosting the productivity of local farmers through mechanization and providing support for the poor who are struggling to cope with the high cost of living.,BusinessMirror,balisacan trying address inflation boosting productivity local farmer mechanization providing support struggling living,216,en
1105,1105,2023-02-21 05:30:05+00:00,1627903464788623361,balisacan said among the causes of high inflation were the typhoons which damaged the country's farmlands as well as delays in the importation of some food products.,BusinessMirror,balisacan cause inflation typhoon damaged country's farmland delay importation product,165,en
1108,1108,2023-02-21 05:18:10+00:00,1627900466490413056,join @infverse_io inflation universe #airdrop campaign !welcome to become #web3 natives and share your web3 experience! #verify to #earn #reviews to earn #infverse https://t.co/8snkjiztnj,d_ennis28,inflation universe campaign welcome native share experience,102,en
1111,1111,2023-02-21 05:07:18+00:00,1627897730030010369,"@abscbnnews philippine inflation hit only 8.7%, yet senate employees will allowance increase of more than 400%! will the senate do the same for all private and public employees also affected by inflation? why not? why only the senate workers?",nreforminajr,philippine inflation senate employee allowance increase senate private public employee affected inflation senate worker,224,en
1112,1112,2023-02-21 04:55:39+00:00,1627894799918567424,@iamwhatiam300 to even have inflation assistance at 12k only to senate employee is laughable and what’s outrageously worst is it was increase to 50k. are you out of your mind? why not give to those who truly are needful? insensitive twerp…my respect for you out to the trashbin…,pinoynayako,inflation assistance senate employee laughable outrageously worst increase truly needful insensitive twerpmy respect trashbin,256,en
1114,1114,2023-02-21 04:48:11+00:00,1627892917863084032,"@datumx11 an elected senate president thinks of a solution for a national crisis, as inflation, that is too limited to his circle. and a band-aid solution can't even before considered a solution of a rational being.",HanKat11,elected senate president think solution national crisis inflation limited circle solution considered solution rational,205,en
1116,1116,2023-02-21 04:41:31+00:00,1627891240292487170,shene ell may inflation assistance 🤭,kaevista,shene inflation assistance,34,en
1118,1118,2023-02-21 04:35:23+00:00,1627889700295053315,"just in : senate president @migzzubiri announced increase of inflation assistance to senate employees from p12,200 to p50,000. 

zubiri made the announcement during monday's flag-raising ceremony. | via @sherieanntorres https://t.co/kwftvtfd4k",iampaulder,senate president announced increase inflation assistance senate employee zubiri announcement monday's raising ceremony,188,en
1120,1120,2023-02-21 04:33:14+00:00,1627889155509219328,"@abscbnnews @migzzubiri if the senate workers allowances are increased by more than 4 times, it is an admission that the country’s inflation has been excessive. will the senate also propose the same huge increase for all govt and private employees? can the country afford it and face more inflation?",nreforminajr,senate worker allowance increased admission country inflation excessive senate propose increase private employee country afford inflation,272,en
1122,1122,2023-02-21 04:24:39+00:00,1627886997187731456,di ako aware senate employees lang pala affected ng inflation 😒🙄,vyuzhabel,aware senate employee affected inflation,61,en
1125,1125,2023-02-21 04:13:03+00:00,1627884079336284160,akala ko ba we're not that high?! bat ung senate need ng inflation assistance @bongbongmarcos,rickalomiasore,akala senate inflation assistance,77,en
1131,1131,2023-02-21 04:01:50+00:00,1627881253272956928,persisting headwinds from rising inflation and higher borrowing costs will muddy the prospects of local equities in the coming months. https://t.co/khx84z2fam,philstarbiznews,persisting headwind rising inflation higher borrowing muddy prospect local equity coming month,134,en
1132,1132,2023-02-21 04:00:18+00:00,1627880869309427715,the @bangkosentral ng pilipinas (bsp) will likely raise its average inflation forecast for this year after the faster-than-expected headline print in january. https://t.co/haaljkcyhe,TheFinancialD,pilipinas likely raise average inflation forecast faster expected headline print january,143,en
1134,1134,2023-02-21 03:50:00+00:00,1627878276101206017,"the department of trade and industry (dti) assured consumers at the weekend they will have access to affordable basic necessities and prime commodities (bnpcs) amid the global inflation.

know more: https://t.co/a1hhwwu9du https://t.co/ppmxvnrxmi",BusinessMirror,department trade industry assured consumer weekend access affordable basic necessity prime commodity bnpcs global inflation,196,en
1137,1137,2023-02-21 03:45:58+00:00,1627877261213933571,"amid high inflation that has been pestering the economy in the past year or so, stakeholders are anticipating a good year for micro, small and medium enterprises, albeit in varying degrees. | @aldenmonzoninq /pdi https://t.co/lwvkhrbarl",inquirerdotnet,inflation pestering economy stakeholder anticipating micro small medium enterprise albeit varying degree,196,en
1138,1138,2023-02-21 03:35:50+00:00,1627874711383478273,"@helenedelmundo sana all employees may inflation assistance. hahahaha. the rest of us not working at the senate, inflation does not apply to us.",dora_lekz,employee inflation assistance hahahaha working senate inflation apply,128,en
1140,1140,2023-02-21 03:20:34+00:00,1627870869556183041,"commodity groups: top 5 contributors

summary inflation report
consumer price index
(2018=100)
january 2023

read more: https://t.co/fhrrxaq3ov https://t.co/c2rtcsfupa",PSASurigaoSur,commodity group contributorssummary inflation reportconsumer price index 2018=100 january,106,en
1143,1143,2023-02-21 02:58:07+00:00,1627865219447033862,inflation assistance baka naman,laNGAYaan,inflation assistance naman,31,en
